{
  "version": 1,
  "generated_by": "judge_synthesizer",
  "round_id": "round-009",
  "judgments": [
    {
      "pattern_id": "invoice_line_item_billing",
      "title": "Invoice line-item billing",
      "domain": "sales_admin",
      "status": "roadmap_candidate",
      "evidence_count": 10,
      "evidence_record_ids": [
        "vertex42_invoice_seed",
        "spreadsheet123_service_invoice_seed",
        "smartsheet_invoice_billing_001",
        "smartsheet_invoice_blank_002",
        "smartsheet_invoice_service_003",
        "smartsheet_invoice_job_006",
        "smartsheet_invoice_commercial_007",
        "smartsheet_invoice_receipt_008",
        "microsoft_accounting_templates_seed",
        "microsoft_business_spreadsheets_seed"
      ],
      "hypothesis_ids": [
        "invoice_line_item_billing"
      ],
      "triggers": [
        "vis_multi_block_form",
        "data_append_rows",
        "val_required_identity",
        "wf_quote_to_invoice"
      ],
      "capability_candidates": [
        "append_structured_rows",
        "extend_table_formulas",
        "add_data_validation",
        "protect_formula_cells",
        "generate_printable_form",
        "join_lookup",
        "group_summarize"
      ],
      "judge_note": "Recurring multi-source invoice forms converge on customer header fields, repeated billable lines, calculated totals, and a print-safe output area. Concrete Sheet Ops candidates are append_structured_rows, extend_table_formulas, add_data_validation, protect_formula_cells, and generate_printable_form; a plausible verifier is to add line rows, preserve totals and tax formulas, and confirm the printable invoice still balances."
    },
    {
      "pattern_id": "monthly_budget_control",
      "title": "Monthly budget control",
      "domain": "finance",
      "status": "roadmap_candidate",
      "evidence_count": 5,
      "evidence_record_ids": [
        "spreadsheet123_budget_seed",
        "edgeryders_budget_template_v3_017",
        "microsoft_accounting_templates_seed",
        "round004_budget_close_template_net_seed",
        "round005_budget_template_net_control_030"
      ],
      "hypothesis_ids": [
        "monthly_budget_control"
      ],
      "triggers": [
        "vis_month_sectioning",
        "data_table_rollup",
        "val_numeric_ranges",
        "wf_period_close"
      ],
      "capability_candidates": [
        "copy_period_sheet",
        "extend_table_formulas",
        "add_data_validation",
        "protect_formula_cells",
        "group_summarize",
        "create_pivot_summary"
      ],
      "judge_note": "Rounds 001-005 now keep this pattern anchored on plan-versus-actual variance control, repeated monthly sections, and close review rather than generic project-cost budgeting. Concrete Sheet Ops candidates are copy_period_sheet, extend_table_formulas, add_data_validation, protect_formula_cells, group_summarize, and create_pivot_summary; a plausible verifier is to roll a new month, edit budget, actual, or forecast values, and confirm variance, over-budget flags, and locked summary regions stay intact through close."
    },
    {
      "pattern_id": "project_timeline_tracker",
      "title": "Project timeline tracker",
      "domain": "project_management",
      "status": "roadmap_candidate",
      "evidence_count": 4,
      "evidence_record_ids": [
        "vertex42_project_gantt_seed",
        "smartsheet_gantt_simple_project_plan_001",
        "smartsheet_gantt_simple_002",
        "smartsheet_project_schedule_dependencies_003"
      ],
      "hypothesis_ids": [
        "project_timeline_tracker"
      ],
      "triggers": [
        "vis_gantt_timeline",
        "data_append_rows",
        "wf_review_approval",
        "val_date_windows"
      ],
      "capability_candidates": [
        "copy_period_sheet",
        "add_data_validation",
        "protect_formula_cells",
        "group_summarize",
        "generate_printable_form"
      ],
      "judge_note": "The refined round-003 boundary holds: these sheets are task-and-date schedules with visible timeline bands, not generic dashboards. Concrete Sheet Ops candidates are copy_period_sheet, add_data_validation, protect_formula_cells, group_summarize, and generate_printable_form; a plausible verifier is to edit task dates, owners, or dependencies and confirm the dated task table and timeline placement stay synchronized."
    },
    {
      "pattern_id": "attendance_register",
      "title": "Matrix attendance register",
      "domain": "education",
      "status": "roadmap_candidate",
      "evidence_count": 22,
      "evidence_record_ids": [
        "vertex42_attendance_seed",
        "spreadsheet123_attendance_form_seed",
        "round004_attendance_matrix_excel_template_seed",
        "round005_attendance_vertex42_sheet_027",
        "round005_attendance_smartsheet_spreadsheet_028",
        "round006_attendance_smartsheet_weekly_005",
        "round006_attendance_smartsheet_student_006",
        "round006_attendance_smartsheet_tracking_007",
        "round007_attendance_smartsheet_excel_tracking_010",
        "round007_attendance_smartsheet_hr_012",
        "round007_attendance_vertex42_schoolyear_014",
        "round007_attendance_vertex42_record_015",
        "round007_attendance_template_net_excel_016",
        "round008_attendance_smartsheet_tracking_003",
        "round008_attendance_smartsheet_dashboard_004",
        "round008_attendance_smartsheet_monthlyrecord_007",
        "round008_attendance_microsoftqa_record_009",
        "round008_attendance_microsoftqa_fiscal_010",
        "round008_attendance_microsoftqa_absence_014",
        "round008_attendance_smartsheet_formula_017",
        "round008_attendance_smartsheet_lock_018",
        "round008_attendance_smartsheet_helper_019"
      ],
      "hypothesis_ids": [
        "attendance_register"
      ],
      "triggers": [
        "vis_calendar_grid",
        "vis_frozen_reference_band",
        "data_period_rollforward",
        "data_formula_cascade"
      ],
      "capability_candidates": [
        "copy_period_sheet",
        "protect_formula_cells",
        "extend_table_formulas",
        "normalize_headers",
        "append_structured_rows"
      ],
      "judge_note": "Across rounds 001-009 the matrix boundary remains roadmap-ready rather than merely recurring: the corpus still combines fixed roster bands, school-year and fiscal roll-forward variants, explicit month and year totals, copy-forward formulas, auto-filled new-row calculations, locked rows or columns, and hidden helper-column control across Smartsheet, Vertex42, Template.net, Microsoft Q&A, and earlier seeds, and round-009 adds no counter-evidence that would widen it back into append-only sign-in logs. Concrete Sheet Ops candidates are copy_period_sheet, protect_formula_cells, extend_table_formulas, normalize_headers, and append_structured_rows; a plausible verifier is to roll the workbook into a new week, month, or fiscal period, add a roster row, and confirm locked totals, helper-column logic, date formulas, and year-to-date summaries survive growth without breaking the matrix."
    },
    {
      "pattern_id": "inventory_movement_log",
      "title": "Inventory movement and reconciliation log",
      "domain": "operations",
      "status": "roadmap_candidate",
      "evidence_count": 6,
      "evidence_record_ids": [
        "vertex42_inventory_seed",
        "spreadsheet123_stocktake_seed",
        "anydb_inventory_transaction_001",
        "prelude_stock_movements_002",
        "xorosoft_inventory_movement_003",
        "syspro_inventory_movements_004"
      ],
      "hypothesis_ids": [
        "inventory_movement_log"
      ],
      "triggers": [
        "data_append_rows",
        "data_reconcile_sources",
        "val_duplicate_prevention",
        "wf_reconciliation_cycle"
      ],
      "capability_candidates": [
        "add_data_validation",
        "extend_table_formulas",
        "flag_outliers",
        "append_structured_rows",
        "reconcile_tables"
      ],
      "judge_note": "Round-003 closes the main gap from round-002 by adding direct transaction-led inventory records for receipts, issues, adjustments, and transfers. Concrete Sheet Ops candidates are append_structured_rows, reconcile_tables, add_data_validation, extend_table_formulas, and flag_outliers; a plausible verifier is to append movement rows, preserve item identifiers, and confirm running movement and reconciliation outputs stay aligned with stock balances."
    },
    {
      "pattern_id": "expense_reimbursement",
      "title": "Expense reimbursement form",
      "domain": "finance",
      "status": "roadmap_candidate",
      "evidence_count": 8,
      "evidence_record_ids": [
        "smartsheet_cost_tracking_008",
        "vertex42_expense_report_020",
        "round004_expense_policy_clicktime_seed",
        "round005_expense_policy_smartsheet_expense_report_001",
        "round005_expense_policy_smartsheet_tracking_002",
        "round005_expense_policy_smartsheet_printable_form_003",
        "round005_expense_policy_template_net_reimbursement_form_004",
        "round005_expense_policy_vertex42_expense_report_007"
      ],
      "hypothesis_ids": [
        "expense_reimbursement"
      ],
      "triggers": [
        "vis_multi_block_form",
        "data_append_rows",
        "val_required_comment",
        "val_numeric_ranges"
      ],
      "capability_candidates": [
        "add_data_validation",
        "append_structured_rows",
        "normalize_headers",
        "generate_printable_form",
        "protect_formula_cells",
        "group_summarize"
      ],